{
  "$schema": "https://json-schema.org/draft/2020-12/schema",
  "$id": "https://github.com/ChudForks/ChudPresence-Activities/blob/main/schemas/activity.schema.json",
  "title": "ChudPresence Activity Metadata",
  "type": "object",
  "additionalProperties": false,
  "required": [
    "id",
    "name",
    "description",
    "version",
    "apiVersion",
    "matches",
    "entry"
  ],
  "properties": {
    "id": {
      "type": "string",
      "pattern": "^[a-z0-9][a-z0-9-]{1,63}$"
    },
    "name": {
      "type": "string",
      "minLength": 1,
      "maxLength": 80
    },
    "description": {
      "type": "string",
      "minLength": 1,
      "maxLength": 500
    },
    "version": {
      "type": "string",
      "pattern": "^(0|[1-9][0-9]*)\\.(0|[1-9][0-9]*)\\.(0|[1-9][0-9]*)(-[0-9A-Za-z-]+(\\.[0-9A-Za-z-]+)*)?(\\+[0-9A-Za-z-]+(\\.[0-9A-Za-z-]+)*)?$"
    },
    "apiVersion": {
      "type": "integer",
      "minimum": 1
    },
    "minExtensionVersion": {
      "type": "string",
      "pattern": "^(0|[1-9][0-9]*)\\.(0|[1-9][0-9]*)\\.(0|[1-9][0-9]*)(-[0-9A-Za-z-]+(\\.[0-9A-Za-z-]+)*)?(\\+[0-9A-Za-z-]+(\\.[0-9A-Za-z-]+)*)?$"
    },
    "author": {
      "type": "object",
      "additionalProperties": false,
      "required": [
        "name"
      ],
      "properties": {
        "name": {
          "type": "string",
          "minLength": 1,
          "maxLength": 80
        },
        "url": {
          "type": "string",
          "format": "uri",
          "pattern": "^https://"
        }
      }
    },
    "contributors": {
      "type": "array",
      "maxItems": 16,
      "items": {
        "type": "object",
        "additionalProperties": false,
        "required": [
          "name"
        ],
        "properties": {
          "name": {
            "type": "string",
            "minLength": 1,
            "maxLength": 80
          },
          "url": {
            "type": "string",
            "format": "uri",
            "pattern": "^https://"
          }
        }
      }
    },
    "category": {
      "type": "string",
      "pattern": "^[a-z][a-z0-9-]{0,31}$"
    },
    "defaultMediaKind": {
      "enum": [
        "video",
        "movie",
        "episode",
        "song",
        "stream",
        "game",
        "generic"
      ]
    },
    "aliases": {
      "type": "array",
      "maxItems": 32,
      "uniqueItems": true,
      "items": {
        "type": "string",
        "minLength": 1,
        "maxLength": 80
      }
    },
    "tags": {
      "type": "array",
      "maxItems": 32,
      "uniqueItems": true,
      "items": {
        "type": "string",
        "pattern": "^[a-z0-9][a-z0-9-]{0,31}$"
      }
    },
    "matches": {
      "type": "array",
      "minItems": 1,
      "maxItems": 32,
      "uniqueItems": true,
      "items": {
        "type": "string",
        "maxLength": 256,
        "pattern": "^https://[^/]+/.+$"
      }
    },
    "excludeMatches": {
      "type": "array",
      "maxItems": 32,
      "uniqueItems": true,
      "items": {
        "type": "string",
        "maxLength": 256,
        "pattern": "^https://[^/]+/.+$"
      }
    },
    "entry": {
      "const": "activity.js"
    },
    "icon": {
      "const": "icon.png"
    },
    "executionWorld": {
      "const": "USER_SCRIPT"
    },
    "frames": {
      "enum": [
        "top",
        "all"
      ]
    },
    "network": {
      "type": "array",
      "maxItems": 32,
      "uniqueItems": true,
      "items": {
        "type": "string",
        "maxLength": 256,
        "pattern": "^https://[^/]+/.+$"
      }
    },
    "settings": {
      "type": "array",
      "maxItems": 32,
      "items": {
        "oneOf": [
          {
            "type": "object",
            "additionalProperties": false,
            "required": [
              "id",
              "type",
              "label",
              "default"
            ],
            "properties": {
              "id": {
                "type": "string",
                "pattern": "^[a-z][A-Za-z0-9_-]{0,63}$"
              },
              "type": {
                "const": "boolean"
              },
              "label": {
                "type": "string",
                "minLength": 1,
                "maxLength": 80
              },
              "default": {
                "type": "boolean"
              }
            }
          },
          {
            "type": "object",
            "additionalProperties": false,
            "required": [
              "id",
              "type",
              "label",
              "default",
              "options"
            ],
            "properties": {
              "id": {
                "type": "string",
                "pattern": "^[a-z][A-Za-z0-9_-]{0,63}$"
              },
              "type": {
                "const": "select"
              },
              "label": {
                "type": "string",
                "minLength": 1,
                "maxLength": 80
              },
              "default": {
                "type": "string",
                "maxLength": 128
              },
              "options": {
                "type": "array",
                "minItems": 1,
                "maxItems": 32,
                "items": {
                  "type": "object",
                  "additionalProperties": false,
                  "required": [
                    "label",
                    "value"
                  ],
                  "properties": {
                    "label": {
                      "type": "string",
                      "minLength": 1,
                      "maxLength": 80
                    },
                    "value": {
                      "type": "string",
                      "maxLength": 128
                    }
                  }
                }
              }
            }
          },
          {
            "type": "object",
            "additionalProperties": false,
            "required": [
              "id",
              "type",
              "label",
              "default"
            ],
            "properties": {
              "id": {
                "type": "string",
                "pattern": "^[a-z][A-Za-z0-9_-]{0,63}$"
              },
              "type": {
                "const": "string"
              },
              "label": {
                "type": "string",
                "minLength": 1,
                "maxLength": 80
              },
              "default": {
                "type": "string",
                "maxLength": 256
              },
              "maxLength": {
                "type": "integer",
                "minimum": 1,
                "maximum": 256
              }
            }
          },
          {
            "type": "object",
            "additionalProperties": false,
            "required": [
              "id",
              "type",
              "label",
              "default",
              "min",
              "max"
            ],
            "properties": {
              "id": {
                "type": "string",
                "pattern": "^[a-z][A-Za-z0-9_-]{0,63}$"
              },
              "type": {
                "enum": [
                  "number",
                  "range"
                ]
              },
              "label": {
                "type": "string",
                "minLength": 1,
                "maxLength": 80
              },
              "default": {
                "type": "number"
              },
              "min": {
                "type": "number"
              },
              "max": {
                "type": "number"
              },
              "step": {
                "type": "number",
                "exclusiveMinimum": 0
              }
            }
          }
        ]
      }
    },
    "settingsUi": {
      "type": "object",
      "additionalProperties": false,
      "properties": {
        "statusLabels": {
          "type": "object",
          "additionalProperties": false,
          "properties": {
            "app": {
              "type": "string",
              "minLength": 1,
              "maxLength": 80,
              "pattern": "\\S"
            },
            "artist": {
              "type": "string",
              "minLength": 1,
              "maxLength": 80,
              "pattern": "\\S"
            },
            "track": {
              "type": "string",
              "minLength": 1,
              "maxLength": 80,
              "pattern": "\\S"
            }
          }
        }
      }
    },
    "repository": {
      "type": "string",
      "format": "uri",
      "pattern": "^https://"
    },
    "homepage": {
      "type": "string",
      "format": "uri",
      "pattern": "^https://"
    },
    "serviceUrl": {
      "type": "string",
      "format": "uri",
      "pattern": "^https://"
    },
    "presence": {
      "type": "object",
      "additionalProperties": false,
      "properties": {
        "navigationGraceMs": {
          "type": "integer",
          "minimum": 0,
          "maximum": 5000,
          "default": 0,
          "description": "Bounded presence retention during in-scope document navigation. Tab close and explicit teardown bypass it. V1 requires extension 2.0.4; V2 requires 2.0.1."
        },
        "kind": {
          "enum": [
            "music",
            "video",
            "streaming",
            "generic"
          ]
        }
      }
    }
  }
}
