{
  "id": "twitch",
  "name": "Twitch",
  "description": "Show the live stream or recorded video playing on Twitch.",
  "version": "1.0.2",
  "apiVersion": 1,
  "author": { "name": "ChudPresence" },
  "category": "streaming",
  "defaultMediaKind": "stream",
  "aliases": ["Twitch.tv"],
  "tags": ["live", "streams", "videos"],
  "serviceUrl": "https://www.twitch.tv/",
  "matches": ["https://www.twitch.tv/*", "https://twitch.tv/*"],
  "entry": "activity.js",
  "icon": "icon.png",
  "presence": { "kind": "video" },
  "settingsUi": {
    "statusLabels": {
      "app": "Twitch",
      "artist": "Streamer",
      "track": "Stream title"
    }
  }
}
