{
  "id": "crunchyroll",
  "name": "Crunchyroll",
  "description": "Show the anime episode or movie playing on Crunchyroll.",
  "version": "1.0.8",
  "apiVersion": 1,
  "author": {
    "name": "ChudPresence"
  },
  "category": "video",
  "defaultMediaKind": "episode",
  "aliases": ["CR", "Crunchyroll"],
  "tags": ["anime", "video", "streaming"],
  "serviceUrl": "https://www.crunchyroll.com/",
  "matches": [
    "https://www.crunchyroll.com/*",
    "https://crunchyroll.com/*",
    "https://beta.crunchyroll.com/*"
  ],
  "entry": "activity.js",
  "icon": "icon.png",
  "presence": {
    "kind": "video"
  },
  "settingsUi": {
    "statusLabels": {
      "app": "Crunchyroll",
      "artist": "Episode / series",
      "track": "Series / episode"
    }
  },
  "settings": [
    {
      "id": "displayOrder",
      "type": "select",
      "label": "Display order",
      "default": "series",
      "options": [
        { "label": "Episode then series", "value": "episode" },
        { "label": "Series then episode", "value": "series" }
      ]
    },
    {
      "id": "showArtwork",
      "type": "boolean",
      "label": "Show artwork",
      "default": true
    }
  ]
}
